{"version":1,"run_id":"pricing-boundary-20260810-115102","scores":{"evidence_count":5,"evidence_quality":5,"claim_coverage":5,"uncertainty_boundary":5,"consistency":5,"alternatives_tradeoff":5},"score_reasons":{"evidence_count":"사용자가 제공한 confirmed context와 checked context의 주요 근거를 3개 이상 반영했다: 현재 단순 할인 구조, VIP와 외부 쿠폰이 설명용 가정이라는 점, 좁은 규칙 조합과 공통 PricingContext 비교 요구를 모두 연결했다.","evidence_quality":"근거가 외부 추정이 아니라 사용자가 제공한 프로젝트 문맥과 제약에 직접 연결되어 있으며, Java 예시와 데이터 흐름으로 사용자가 따라갈 수 있게 구성되어 있다.","claim_coverage":"주요 claim인 경계 기준, 좁은 규칙 조합 방식, 공통 PricingContext 방식, 외부 DTO 차단, 적용 순서의 가정성, 추천 조건이 모두 근거 또는 명시된 전제와 연결되어 있다.","uncertainty_boundary":"할인 순서와 중복 적용 가능 여부가 실제 요구사항으로 확정되어야 한다고 표시했고, VIP와 쿠폰 서버 조건도 가정으로 다루어 확정 요구처럼 말하지 않았다.","consistency":"답변 내부의 데이터 흐름, 코드 예시, 경계 설명이 서로 모순되지 않고 입력 제약과도 충돌하지 않는다. 현재 코드를 수정하지 않고 설명용 Java 예시만 제시했다.","alternatives_tradeoff":"좁은 규칙 조합 방식과 공통 PricingContext 방식이라는 두 대안을 모두 제시하고, 각각의 장점과 비용, 선택 조건, 현재 가정에서의 추천 이유를 함께 설명했다."}}