{"version":1,"run_id":"taskb2-feedback-analysis-20260803","scores":{"evidence_count":5,"evidence_quality":4,"claim_coverage":4,"uncertainty_boundary":4,"consistency":4,"alternatives_tradeoff":5},"score_reasons":{"evidence_count":"4개 피드백 항목마다 원 주장, 피드백 내용, 대응 후보를 연결해 근거 앵커 수는 충분하다.","evidence_quality":"근거 원천은 사용자 제공 task/피드백 문맥이라 강하지만, 본문에 파일·라인 인용이 없어 추적성은 한 단계 약하다.","claim_coverage":"주요 주장 대부분이 원 주장 복원, 피드백 해석, 후보별 trade-off와 연결되지만 일부 최종 추천은 명시적 근거 연결이 압축돼 있다.","uncertainty_boundary":"적합 조건과 전제를 자주 밝혀 경계를 대체로 지켰지만, 몇몇 해석과 추천이 추정임을 더 분명히 표시하지는 않았다.","consistency":"내부 모순은 없고 원 주장 범위도 대체로 유지되지만, 일부 추천은 현재 예제 맥락을 암묵적으로 전제한다.","alternatives_tradeoff":"각 피드백마다 2~3개 대안과 장단점, 적용 조건, 추천 방향이 함께 제시돼 이 축은 강하다."}}