{"version":1,"run_id":"taskd5-agent-transcription-routing-review-20260826","scores":{"evidence_count":5,"evidence_quality":5,"claim_coverage":4,"uncertainty_boundary":5,"consistency":4,"alternatives_tradeoff":5},"score_reasons":{"evidence_count":"OpenAI transcription API, gpt-transcribe model page, GPT-5-Codex modality, Claude upload/CLI docs, and project context are all used as anchors.","evidence_quality":"The key factual claims are grounded in official API/model documentation, Anthropic documentation, and checked project context rather than secondary sources.","claim_coverage":"Most major claims are tied to evidence or explicit limits, including no manual split, non-local API inference, Codex modality limits, Claude orchestration, cost, and filler-word risk. A few recommendation claims such as 'most simple' are justified mainly by synthesis rather than direct evidence.","uncertainty_boundary":"Important uncertain areas are clearly bounded: filler-word preservation is not guaranteed, calibration is required, Claude direct transcription is not confirmed, and API billing/key requirements are stated.","consistency":"No direct contradiction appears, but the MP4 wording could be read broadly despite the checked context distinguishing audio input from video modality, so one scope boundary is slightly under-specified.","alternatives_tradeoff":"The draft compares Codex plus gpt-transcribe, Claude plus external STT, and local SeloWhisper with manual split, local inference, strengths, weaknesses, and a recommendation."}}