{"version":1,"run_id":"taskc2-simplified-gate-20260724","scores":{"evidence_count":5,"evidence_quality":5,"claim_coverage":4,"uncertainty_boundary":4,"consistency":4,"alternatives_tradeoff":5},"score_reasons":{"evidence_count":"프로젝트 과제 파일, 이전 critique, 이전 validation 등 3개 이상의 근거 anchor가 명시되어 있다.","evidence_quality":"근거가 사용자 제공 입력과 프로젝트 파일, run artifact에 연결되어 있어 사용자가 추적 가능한 1차 맥락에 가깝다.","claim_coverage":"주요 claim 대부분이 입력의 제약과 기존 critique 지적, 결정표, 예시로 연결된다. 다만 일부 STRONG/WEAK 세부 신호는 왜 그 임계에 배치되는지 근거 연결이 약하다.","uncertainty_boundary":"미래 저장 기술, 팀 역량, 성능, 업무 중요도, 임계값 보정 필요를 한계로 분리했다. 다만 비자명 업무 규칙 판정의 주관성은 별도 한계로 충분히 드러나지 않는다.","consistency":"Task C-1의 의존성 중심 결론과 입력 제약을 대체로 보존하며 내부 결정표도 모순 없이 이어진다. 다만 P=NONE에 약한 신호 1개를 포함시키는 명명은 독자가 조건을 놓치면 오해할 여지가 있다.","alternatives_tradeoff":"기존 6축 유지, 불변식 단일 기준, D/P/M 3축을 비교하고 각 비용과 실패 가능성, 추천 이유를 함께 제시한다."}}