{"version":1,"run_id":"hexagonal-solves-ntier-20260724","scores":{"evidence_count":4,"evidence_quality":4,"claim_coverage":4,"uncertainty_boundary":4,"consistency":4,"alternatives_tradeoff":1},"score_reasons":{"evidence_count":"Cockburn 원문, DIP 원문, 사용자 제공 과제 맥락을 근거로 연결했지만 명시적 evidence anchor 수가 아주 많지는 않다.","evidence_quality":"공식 아키텍처 글과 DIP 원문, 사용자 제공 과제 맥락에 기대고 있어 근거 신뢰도는 높지만 일부 실천적 효과 주장에는 직접 anchor가 약하다.","claim_coverage":"주요 claim 대부분이 prior critique, Cockburn, DIP와 연결되지만 테스트 비용 절감이나 단순 CRUD 비용 같은 일부 claim은 근거나 조건 표시가 덜하다.","uncertainty_boundary":"헥사고날의 한계와 Port 누수 조건은 분명히 적었지만 일부 적용 효과가 조건부라는 점을 더 넓게 표시할 여지는 남아 있다.","consistency":"compile-time dependency와 runtime call flow를 명확히 구분했고 전체 서술도 서로 맞물리지만 효과 범위와 적용 전제는 몇 군데 더 선명할 수 있다.","alternatives_tradeoff":"추천 방향과 한계는 설명했지만 대안 구조를 2개 이상 비교하거나 각 대안의 trade-off를 체계적으로 제시하지는 않았다."}}