{"version":1,"run_id":"speech-rehearsal-implementation-review-20260826","scores":{"evidence_count":5,"evidence_quality":4,"claim_coverage":5,"uncertainty_boundary":4,"consistency":5,"alternatives_tradeoff":3},"score_reasons":{"evidence_count":"초안은 SKILL.md, role Markdown, rubric YAML, schema, scripts, custom agent TOML, 단위 테스트, schema 검사, duplication scan 등 3개를 훨씬 넘는 프로젝트 근거와 연결되어 있다.","evidence_quality":"근거는 대부분 사용자가 제공한 checked context와 프로젝트 파일, 테스트 결과에 연결되어 신뢰도가 높다. 다만 명령어 원문, 파일 라인, 구체 출력까지 제시하지는 않아 사용자가 즉시 재현 경로를 따라가기에는 약간 부족하다.","claim_coverage":"사용자의 핵심 조건인 별도 runner 없음, prompt와 rubric 책임 위치 분리, Python scripts의 mechanics-only 역할, reviewer 병렬 실행, 검증 결과와 미검증 범위를 모두 다룬다. 주요 claim 대부분이 입력 context의 근거 또는 명시적 한계와 연결되어 있다.","uncertainty_boundary":"PyYAML 부재로 quick_validate.py를 실행하지 못한 점, OPENAI_API_KEY 부재로 live transcription을 실행하지 못한 점, 실제 reviewer 결과 품질은 추후 확인해야 한다는 점을 명확히 표시했다. 다만 '구현 완료'라는 제목은 live API와 실제 reviewer 품질 미검증 범위에 비해 다소 강하게 읽힐 수 있다.","consistency":"초안은 입력 context와 큰 모순이 없다. 역할·rubric·schema·orchestration 책임 위치, runner 부재, prompt duplication 방지, 검증 한계 설명이 서로 일관된다.","alternatives_tradeoff":"이번 답변은 구현 완료 보고 성격이라 대안 비교의 필요성이 낮지만, 구현 선택지나 남은 검증 방식의 trade-off는 거의 다루지 않는다. 이미 승인된 방향을 실행했다는 맥락은 있으나 대안과 추천 이유를 비교하는 축에서는 보통 수준이다."}}