{"version":1,"run_id":"taskb6-fb01-20260810","scores":{"evidence_count":5,"evidence_quality":4,"claim_coverage":4,"uncertainty_boundary":4,"consistency":4,"alternatives_tradeoff":4},"score_reasons":{"evidence_count":"근거가 runner.py, final.json, PROBLEM.md, 원래 과제 파일 등 3개 이상 프로젝트 자료에 연결되어 있다.","evidence_quality":"근거가 주로 프로젝트 파일과 실행 산출물이라 신뢰도는 높다. 다만 behavior_gate.py 근거가 최종 근거 목록에 직접 포함되지 않고 일부 파일은 세부 위치가 약하다.","claim_coverage":"행위 게이트의 범위, LLM Eval의 성격, 자기평가 편향, Goodhart 위험, Critique와 PASS의 불일치 등 주요 claim 대부분이 근거나 한계 표시와 연결되어 있다. 일부 평가적 표현은 근거 연결이 간접적이다.","uncertainty_boundary":"LLM Eval이 무가치한 것은 아니라는 경계, 같은 모델 계열의 오류 상관 가능성, Critique 판단의 한계를 명시한다. 다만 일부 대응 방향의 정책 판단은 추가 결정 필요성이 더 분명히 표시될 수 있다.","consistency":"답변은 입력 맥락과 대체로 일관되고, 행위 보존과 설계 품질 평가를 구분한다. 큰 모순은 없지만, Critique를 품질 단계로 소개했다는 표현은 실제 문서 표현 근거가 더 직접적으로 붙으면 좋다.","alternatives_tradeoff":"문구 수정, 판정 상태 분리, 외부 기준 보정의 3개 대응안을 제시하고 장단점을 비교한다. 다만 어떤 대응을 우선 추천하는지와 그 이유는 명시적으로 고정하지 않는다."}}