{"version":1,"run_id":"collector-proposal-semantics-20260628","scores":{"evidence_count":4,"evidence_quality":4,"claim_coverage":4,"uncertainty_boundary":4,"consistency":4,"alternatives_tradeoff":5},"score_reasons":{"evidence_count":"validation.json, eval.json, critique.md, run_id/attempt 구조 등 입력의 Checked Context와 연결되는 근거가 여러 개 사용되지만, 파일 경로 단위로 명시되지는 않는다.","evidence_quality":"근거가 프로젝트 artifact와 사용자가 제공한 context에 기반해 신뢰 가능하지만, draft 안에서 각 claim별로 출처를 직접 연결하는 방식은 약하다.","claim_coverage":"collector 실행 시점, latest/history 산출, axis와 critique 수집, attempt 병합, 중복 run 감지, proposal 수동 실행 등 주요 질문 대부분을 근거 또는 이유와 함께 다룬다.","uncertainty_boundary":"MVP, 나중 단계, 선택 옵션, 자동 병합 위험 등 경계가 대부분 표시되어 있으나 collector/proposal이 아직 미구현이라는 전제는 draft에 직접 드러나지 않는다.","consistency":"입력 context 및 artifact 구조와 모순되는 내용은 보이지 않으며, 자동 수정 금지와 수동 승인 흐름도 일관된다. 다만 collect.py 같은 명령은 설계안인지 구현된 명령인지 약간 모호하다.","alternatives_tradeoff":"수동 실행, runner 옵션, 주간 자동화/CI, latest와 history, duplicate_candidates와 자동 병합 금지, manual proposal과 auto-propose 옵션을 비교하고 추천 이유와 trade-off를 함께 제시한다."}}