{"version":1,"run_id":"taskd2-reader-immersion-review-20260826","scores":{"evidence_count":5,"evidence_quality":5,"claim_coverage":4,"uncertainty_boundary":4,"consistency":5,"alternatives_tradeoff":5},"score_reasons":{"evidence_count":"본문 안에 AI 평가 누락 2건, 리네임 후 6개 테스트 통과, 18개 시나리오 중 2개 검출, 할인 호출 예시 등 3개 이상의 근거가 연결되어 있다.","evidence_quality":"근거가 사용자가 제공한 프로젝트 문맥, 테스트 결과, 리팩터링 기록, 코드 예시에 기반하며 블로그 본문에는 독자를 방해하지 않는 형태로 흡수되어 있다.","claim_coverage":"핵심 주장 대부분이 수치, 전후 비교, 코드 예시, 판정 방식 비교와 연결되어 있다. 다만 AI 평가가 매번 흔들린다는 도입부의 일반화는 본문 안에서 반복 관찰 근거가 충분히 분리되어 제시되지는 않는다.","uncertainty_boundary":"연결 코드가 아직 빨간불을 보지 못했다는 한계와 다음 실험의 추정은 명확히 표시되어 있다. 일부 넓은 일반화는 경험 기반 주장처럼 쓰여 경계가 조금 더 좁혀질 여지가 있다.","consistency":"검토 문맥과 충돌하지 않는다. 블로그 본문에서는 내부 파일 링크와 작업 표기를 제거하고, 필요한 근거는 수치와 예시로 직접 제시한다는 사용자 요구와 일관된다.","alternatives_tradeoff":"단위 테스트를 명세로 쓰는 안, 생성 테스트로 생성 산출물을 판정하는 안, 도메인 명세를 동결하는 안을 비교하고 버린 이유와 남은 비용을 함께 제시한다."}}