{"version":1,"run_id":"level3-level-design-judgment-20260628-final","scores":{"evidence_count":5,"evidence_quality":5,"claim_coverage":4,"uncertainty_boundary":5,"consistency":4,"alternatives_tradeoff":5},"score_reasons":{"evidence_count":"AGENTS.md, SKILL.md, PROBLEM.md, checklist, 기존 Level 3 run 등 3개 이상의 프로젝트 근거에 연결되어 있다.","evidence_quality":"근거가 모두 사용자가 제공한 프로젝트 파일과 기존 run 문맥에 기반하므로 출처를 따라가며 확인할 수 있다.","claim_coverage":"3단계 구조가 조건부로 적절하다는 결론, Level별 역할, 판정 규칙, 점수 노출 제한, 대안 비교는 근거나 설명과 연결되어 있다. 다만 운영 검증의 구체 조건 중 review case 2개 이상 같은 세부 기준은 덜 직접적으로 반영되어 100% 커버리지로 보기는 어렵다.","uncertainty_boundary":"3단계가 보편적 정답은 아니라는 점, 운영 비용이 아직 충분히 검증되지 않았다는 점, 실제 대화에서 관찰해야 할 항목을 명시해 필요한 불확실성 경계를 잘 표시한다.","consistency":"초안은 Level 3 우선, Level 2 조건부 적용, Level 3 artifact/gate 분리 등 제공된 문맥과 대체로 일관된다. 다만 PROBLEM.md의 남은 해결 조건을 완전히 세부적으로 재진술하지는 않아 조건 누락 가능성이 일부 남는다.","alternatives_tradeoff":"Level 1만 유지, Level 1+3, 전체 Level 3 통일, 현재 3단계 유지안을 비교하고 각 방식의 비용, 속도, 재현성, anchoring 위험과 추천 이유를 함께 제시한다."}}