{"version":1,"run_id":"b5-01-policy-input-20260810-114207","scores":{"evidence_count":5,"evidence_quality":5,"claim_coverage":4,"uncertainty_boundary":5,"consistency":5,"alternatives_tradeoff":5},"score_reasons":{"evidence_count":"`DiscountPolicy.java:11`, `TicketService.java:31`, 피드백의 VIP·쿠폰 가정, 현재 답안의 트리거 해석 등 3개 이상의 근거 지점과 연결된다.","evidence_quality":"근거가 프로젝트 파일 위치와 사용자가 제공한 run 입력에 연결되어 있어 사용자가 따라가며 확인할 수 있다.","claim_coverage":"현재 계약, 불필요한 공통 입력의 위험, 다형성 자체와 넓은 계약의 구분, 트리거 재해석은 근거 또는 조건과 연결된다. 다만 `PricingService` 조합 구조 제안은 설계 판단 근거가 주로 설명 내부 논리에 의존한다.","uncertainty_boundary":"VIP 등급과 외부 쿠폰을 아직 확정 요구가 아닌 가정으로 표시하고, 각 접근을 입력 모양이 실제로 같거나 다를 때라는 조건으로 경계 짓는다.","consistency":"현재 코드 근거와 답변 결론이 모순되지 않고, 다형성 도입 조건을 같은 최소 입력과 같은 결과 계약으로 좁혀 일관되게 유지한다.","alternatives_tradeoff":"작은 공통 계약, 정책별 좁은 규칙과 오케스트레이션, 공통 `PricingContext` 통합의 3개 대안을 제시하고 각 장단점과 추천 이유를 함께 설명한다."}}