{"version":1,"run_id":"taskd5-simplest-transcriber-review-20260826","scores":{"evidence_count":5,"evidence_quality":4,"claim_coverage":4,"uncertainty_boundary":4,"consistency":4,"alternatives_tradeoff":5},"score_reasons":{"evidence_count":"SeloWhisper model card, Transformers ASR documentation, VoxLab repository, and the checked context provide more than three evidence anchors for the main comparison.","evidence_quality":"Most cited anchors are primary or near-primary sources such as official documentation, model cards, and project repositories, but a few claims such as pitchprompter status and the exact speech-rate metric are not directly linked in the draft.","claim_coverage":"The main claims about SeloWhisper being simpler for this MVP, filler-recall limits, chunking support, and alternative choices are connected to evidence or caveats. Some implementation choices remain lightly justified.","uncertainty_boundary":"The draft clearly marks that filler omission is not eliminated and that self-evaluation has limits, but it does not fully carry over all uncertainty from the context, such as SeloWhisper long-form validation and local resource implications of a 0.8B model.","consistency":"The answer is internally consistent and aligns with the checked context. Minor scope and condition omissions remain around long-form use, ffmpeg/input handling, and whether character-per-minute is the intended speech-rate metric.","alternatives_tradeoff":"The draft compares SeloWhisper single pass, faster-whisper single pass, and a two-pass option with clear trade-offs and explains why SeloWhisper is the recommended MVP path."}}