{"version":1,"run_id":"taskc2-countable-gate-20260724","scores":{"evidence_count":5,"evidence_quality":4,"claim_coverage":4,"uncertainty_boundary":5,"consistency":4,"alternatives_tradeoff":5},"score_reasons":{"evidence_count":"프로젝트 파일 3개 이상의 맥락과 사용자가 준 제약을 직접 연결해 근거 수는 충분하다.","evidence_quality":"근거가 프로젝트 파일과 제공 입력에 연결되어 신뢰도는 높지만, draft의 일부 exact line reference는 이번 eval 입력만으로 직접 검증되지는 않는다.","claim_coverage":"주요 결정표, 계수 기준, NOT_EVALUABLE, calibration 필요성 대부분이 근거 또는 정책 제안 경계와 연결된다. 다만 S/C 임계값 같은 일부 세부 기준은 근거보다 제안 성격이 강하다.","uncertainty_boundary":"업계 보편 법칙이 아니라 v0.1 팀 정책이며, 임계값은 과거 Aggregate로 calibration해야 한다고 명확히 한계를 표시한다.","consistency":"항상 분리/통합을 피하고 불변식 1개만으로 분리하지 않는다는 제약과 대체로 일치한다. 다만 판정 단위를 Aggregate로 좁혀 bounded feature 가능성 및 scope 누락 시 NOT_EVALUABLE 처리가 약간 덜 명시적이다.","alternatives_tradeoff":"항상 통합, 불변식 즉시 분리, 증거 기반 단계 게이트를 비교하고 각 장단점과 추천 이유를 제시한다."}}