{"version":1,"run_id":"taskc2-deduplicate-20260724","scores":{"evidence_count":5,"evidence_quality":4,"claim_coverage":4,"uncertainty_boundary":4,"consistency":5,"alternatives_tradeoff":5},"score_reasons":{"evidence_count":"초안은 Jakarta Persistence 명세, Spring PetClinic, Buckpal, Microsoft 문서, Netflix와 Shopify 사례 등 3개 이상의 근거 링크를 연결한다.","evidence_quality":"공식 명세와 공식 문서, 실제 프로젝트 저장소를 포함해 근거 품질이 높다. 다만 일부 보조 사례는 기술 블로그이고 저장소의 현재 구조에 의존하는 claim은 별도 실행 확인까지는 없다.","claim_coverage":"D/P 기준 재배치, 중복 제거, 통합과 분리의 비용, 현장 조건 해석, 예시 판단 대부분이 근거 또는 조건 설명과 연결된다. 일부 공개 사례 해석은 요약적 연결에 머문다.","uncertainty_boundary":"시스템 크기, Legacy Schema, 여러 팀 공유, 조회 모델처럼 조건부 판단이 필요한 부분에 가능성 또는 보조 문맥으로 경계를 표시한다. 외부 저장소와 공개 사례의 최신성 경계는 더 명시할 수 있다.","consistency":"요청된 순서인 Trade-off, 개인 기준, 현장 적용, 분리 방식, 예시, 참고 흐름을 따른다. D/P 정의는 개인 기준 섹션에서 한 번만 제시되고 현장 섹션은 이를 적용하므로 내부 모순이나 범위 누락이 보이지 않는다.","alternatives_tradeoff":"통합, 분리, 부분 분리나 조회 모델 분리 같은 대안을 비교하고, D AND P 기준 및 Mapper 비용에 따른 추천 이유와 trade-off를 함께 제시한다."}}