{"version":1,"run_id":"practical-feedback-loop-20260628","scores":{"evidence_count":4,"evidence_quality":4,"claim_coverage":4,"uncertainty_boundary":3,"consistency":4,"alternatives_tradeoff":4},"score_reasons":{"evidence_count":"초안은 runs artifact, validation/eval/critique, weak_axes, weighted_score, rubric 축 등 입력 문맥의 여러 근거 앵커를 활용한다. 다만 근거 파일명을 직접 반복해 연결하는 방식은 제한적이다.","evidence_quality":"근거는 사용자가 제공한 프로젝트 파일과 artifact 구조에 기반해 신뢰도가 높다. 그러나 실행 결과나 샘플 report 출력처럼 구현 가능성을 확인한 근거는 포함하지 않는다.","claim_coverage":"collector, proposal 기반 느린 개선 루프, 승인 전 자동 수정 금지, 회귀 확인, 완료 기준 등 주요 claim 대부분이 근거 또는 설계 선택으로 설명된다. 일부 세부 기준은 왜 그 임계값인지 근거가 약하다.","uncertainty_boundary":"오래된 run 처리, proposal 생성 임계값, report overwrite 정책처럼 설계 선택인 지점이 단정적으로 제시된다. 예시 표현은 있으나 가정과 조정 가능성 표시가 충분하지 않다.","consistency":"입력의 현재 구조와 대체로 일관되며 자동 기준 변경을 금지한다는 제약과도 맞는다. 다만 collect 명령의 상대 경로 기준, read-only와 report 생성의 범위 같은 전제는 더 명확히 할 여지가 있다.","alternatives_tradeoff":"collector만 하는 방식, 자동 patch까지 가는 방식, collector plus proposal 방식의 trade-off와 추천 이유가 드러난다. 다만 대안별 비교가 표나 동일한 기준으로 완전히 정리되지는 않았다."}}