{"version":1,"run_id":"discount-new-boundary-20260810-165528","scores":{"evidence_count":5,"evidence_quality":5,"claim_coverage":5,"uncertainty_boundary":4,"consistency":4,"alternatives_tradeoff":5},"score_reasons":{"evidence_count":"사용자 입력의 핵심 전제인 직접 new 문제, 현재 kata 조건, 런타임 선택 요구 부재, Spring 미사용 조건을 모두 답변 판단 근거로 연결했다.","evidence_quality":"근거가 사용자가 제공한 확인 문맥과 초안 안의 구체 Java 예시, 구조 다이어그램에 연결되어 있어 사용자가 추적 가능하다.","claim_coverage":"주요 claim인 new와 구체 의존의 구분, Composition Root 추천, Resolver 조건, Spring DI 조건, Factory 남용 경고가 각각 근거 또는 조건과 연결되어 있다.","uncertainty_boundary":"런타임 선택이 있을 때와 Spring 애플리케이션일 때처럼 조건부 경계를 잘 표시했다. 다만 현재 문맥의 실제 클래스가 TicketService라는 점을 직접 반영하지 않아 적용 범위 경계가 약간 흐리다.","consistency":"답변 내부 모순은 없고 입력 제약도 대부분 충족한다. 다만 확인 문맥의 TicketService 대신 PricingService 중심으로 설명해 현재 코드 맥락과의 명시적 연결은 일부 누락됐다.","alternatives_tradeoff":"수동 Composition Root, Resolver 또는 Factory, Spring DI를 모두 비교하고 각 선택지의 이득, 비용, 추천 조건을 함께 제시했다."}}