{"version":1,"run_id":"taskd2-reader-immersion-review-20260826","scores":{"evidence_count":5,"evidence_quality":5,"claim_coverage":4,"uncertainty_boundary":4,"consistency":5,"alternatives_tradeoff":5},"score_reasons":{"evidence_count":"본문 안에 AI 평가 누락, 리네임 후 6개 테스트 통과, 18개 시나리오 중 2개 실패, 할인 테스트 예시 등 3개 이상의 구체 근거가 연결되어 있다.","evidence_quality":"근거가 사용자 제공 문맥의 프로젝트 기록, 테스트 결과, 코드 예시와 연결되어 있고, 독자가 외부 파일을 열지 않아도 판단할 수 있게 본문 안에 흡수되어 있다.","claim_coverage":"대부분의 주요 claim은 수치, 전후 비교, 코드 예시, 관찰 결과와 연결되어 있다. 다만 AI 평가가 매번 흔들린다는 넓은 서술은 본문 내 직접 근거가 상대적으로 약해 5점은 아니다.","uncertainty_boundary":"연결 코드의 빨간불 미검증, 16개 초록 시나리오의 한계, 직접 재현하지 않은 대안의 위험을 명시했다. 일부 도입부의 일반화된 AI 평가 흔들림은 한계 표시가 약하다.","consistency":"블로그 본문은 내부 파일 링크를 제거하면서도 검증 수치와 사례를 유지한다. 발행 제외 작업 메모와 자가 점검은 본문 범위 밖으로 분리되어 있고, 내부 모순은 보이지 않는다.","alternatives_tradeoff":"단위 테스트를 명세로 쓰는 안과 AI 생성 테스트를 판정 기준으로 삼는 안을 버린 이유가 제시되고, 도메인 명세 동결과 연결 코드 재생성의 장단점과 남은 비용이 함께 드러난다."}}