{"version":1,"run_id":"taskb2-feedback-refinement-20260803","scores":{"evidence_count":5,"evidence_quality":4,"claim_coverage":4,"uncertainty_boundary":5,"consistency":4,"alternatives_tradeoff":5},"score_reasons":{"evidence_count":"FB-B2-01, 02, 04 각각에 대해 예시, 조건, 반례를 붙인 연결 근거가 3개 이상 있다.","evidence_quality":"근거가 사용자 입력과 확인된 문맥에 직접 연결돼 있고 시나리오 기반 설명도 구체적이지만, 원문 과제 문서나 실행 결과를 직접 인용한 수준은 아니다.","claim_coverage":"주요 주장 대부분이 근거나 조건부 표현과 연결돼 있지만, 일부 추천 구조 설명은 설계 추론 비중이 커서 완전한 100% 커버리지로 보기는 어렵다.","uncertainty_boundary":"로컬 트랜잭션 가능 여부, 외부 카드 승인 처리, 상태 기반 워크플로 도입 시점 등 불확실성이 필요한 지점에 조건과 한계를 명시했다.","consistency":"내부 모순은 없고 2번과 3번의 관계도 분리해 설명했지만, 추천 구조의 적용 전제와 중복 비용 범위는 조금 더 좁혀 쓸 여지가 있다.","alternatives_tradeoff":"공통 `PaymentMethod`, `ReservationFlow`, 상태 기반 워크플로 등 대안을 나누고 각 선택지의 장단점과 추천 조건을 함께 제시했다."}}