{"version":1,"run_id":"fb-b5-02-20260810-170234","scores":{"evidence_count":4,"evidence_quality":4,"claim_coverage":4,"uncertainty_boundary":5,"consistency":5,"alternatives_tradeoff":5},"score_reasons":{"evidence_count":"초안은 FB-B5-02 원문 위치, 사용자가 제공한 FB-B5-01 합의, 입력의 프로젝트 문맥을 근거로 연결한다. 다만 `refactoring-criteria.md`나 `change-resilience-test.md` 같은 확인된 문맥의 파일 근거를 초안 안에서 직접 다시 앵커링하지는 않아 5점은 아니다.","evidence_quality":"근거는 사용자 제공 문맥과 프로젝트 파일 위치에 연결되어 신뢰 가능한 편이다. 그러나 일부 핵심 배경은 입력 문맥을 재서술하는 수준이고, 사용자가 따라갈 수 있는 파일 경로와 라인 앵커가 충분히 반복되지는 않는다.","claim_coverage":"준비 리팩토링과 다형성 도입 분리, `v >= 2`의 의미, YAGNI 경계, 조기 스멜 대부분이 근거 또는 조건과 연결된다. 다만 스멜 목록의 일부 항목은 구체 프로젝트 증거라기보다 일반화된 판단으로 제시된다.","uncertainty_boundary":"초안은 요구가 아직 하나일 때, 실제 마찰이 관찰될 때, 두 번째 정책이 가까운 일정으로 확정됐을 때처럼 조건을 명확히 나눈다. 미래 확장 가능성과 현재 증거의 경계도 분명하다.","consistency":"입력의 제약과 논의 흐름에 모순되지 않는다. FB-B5-01 확정 정리, FB-B5-02 원 주장과 피드백 대조, 추천 답변이 서로 같은 결론을 유지한다.","alternatives_tradeoff":"추천안을 포함해 3개 대응 후보를 제시하고 각 후보마다 얻는 것, 비용, 적합 조건을 비교한다. 최종 추천 이유도 명확하다."}}