{"version":1,"run_id":"taskc3-hexagonal-review-20260724","scores":{"evidence_count":5,"evidence_quality":4,"claim_coverage":3,"uncertainty_boundary":3,"consistency":3,"alternatives_tradeoff":1},"score_reasons":{"evidence_count":"기존 포트 의존성, Inbound 경계와 Step Definition, Adapter 현황, Repository 저장 의미, 테스트 실행 결과 등 세 개 이상의 근거가 주요 판단에 연결되어 있다.","evidence_quality":"프로젝트 파일과 실제 테스트 결과에 기반하지만, 초안에는 대부분의 정확한 파일 경로나 제출물 내용이 제시되지 않아 사용자가 근거를 직접 추적하기에는 일부 부족하다.","claim_coverage":"기존 구조의 판정과 주요 보완점은 근거에 연결되지만, 제출물에 반영했다는 주장, CancelChargePort로 고정했다는 주장, C-0 상태는 입력에서 확인되지 않는다.","uncertainty_boundary":"후속 과제가 아직 구현되지 않았고 Repository 문제가 발생할 수 있다는 경계는 표시했지만, 제출물 변경과 보상 시나리오 반영 여부는 확인 조건 없이 완료된 사실처럼 서술한다.","consistency":"확인된 프로젝트 문맥과 정면으로 모순되지는 않지만, 실제 제출물 내용이나 변경 증빙 없이 반영 완료를 단정하며 C-0을 언급하는 등 범위와 전제가 누락되어 있다.","alternatives_tradeoff":"현재 구조를 명시적으로 보완하는 한 가지 방향만 제시하며, 별도 Inbound Port 도입 여부를 포함한 대안별 장단점과 추천 이유는 초안에 드러나지 않는다."}}