{"version":1,"run_id":"taskb4-feedback-reframe-20260804","scores":{"evidence_count":5,"evidence_quality":4,"claim_coverage":4,"uncertainty_boundary":4,"consistency":4,"alternatives_tradeoff":5},"score_reasons":{"evidence_count":"ChargePort.java, taskB-4.md, B-2/B-4 맥락, 사용자 피드백 등 여러 프로젝트 근거를 직접 연결한다.","evidence_quality":"주요 근거는 프로젝트 파일과 사용자 제공 맥락이라 추적 가능하지만, 비동기 모델링과 과설계 판단 일부는 해석 비중이 남는다.","claim_coverage":"핵심 주장 대부분이 파일 근거나 조건부 판단과 연결되지만, 일부 일반 설계 판단은 명시적 anchor가 약하다.","uncertainty_boundary":"리뷰어 의도는 해석이라고 표시하고 비동기 도입 여부에 따른 조건도 나누지만, 몇몇 일반화된 설계 진술은 추정 경계가 더 선명할 수 있다.","consistency":"내부 모순은 없고 추천 방향도 일관되지만, 현재 kata 요구 범위와 일반 설계 원칙 사이의 전제는 일부 독자가 더 확인하고 싶을 수 있다.","alternatives_tradeoff":"동기 계약 유지, 비동기 수명주기 전환, Pending 반환, Repository 유지 vs 명시적 Port 명명까지 대안과 비용을 함께 비교한다."}}