{"version":1,"run_id":"taskd2-transition-review-20260826","scores":{"evidence_count":5,"evidence_quality":5,"claim_coverage":5,"uncertainty_boundary":4,"consistency":5,"alternatives_tradeoff":5},"score_reasons":{"evidence_count":"초안은 할인 테스트의 설계 고정, 환불 리팩터링, 정책과 호출 방식 분리, 전환 문장 대안 등 3개 이상의 근거 지점을 답변에 연결했다.","evidence_quality":"근거가 모두 사용자가 제공한 원문과 checked context의 발행본 내용에 직접 연결되어 있어 사용자가 확인 가능하다.","claim_coverage":"주요 판단인 흐름의 부자연스러움, 의도 표현의 보정, 추천 흐름, 제목과 단락 예시, 대안 비교가 모두 입력 맥락이나 명시된 근거와 연결되어 있다.","uncertainty_boundary":"대부분의 판단은 제공 자료에 근거해 충분히 경계가 잡혀 있다. 다만 제목이 가장 잘 이어진다거나 사례 유지가 가장 좋다는 표현은 글쓰기 판단의 주관성을 조금 더 드러낼 여지가 있다.","consistency":"초안은 입력과 checked context에 모순되지 않는다. 특히 정책은 유지되고 호출 방식이 바뀌었다는 관찰을 일관되게 유지한다.","alternatives_tradeoff":"전환 문장만 추가하는 안, 리팩터링 사례를 빼는 안, 사례를 유지하고 절 역할을 바꾸는 안을 비교하고 각 trade-off와 추천 이유를 함께 제시했다."}}