{"version":1,"run_id":"taskc3-hexagonal-review-20260724","scores":{"evidence_count":5,"evidence_quality":5,"claim_coverage":4,"uncertainty_boundary":5,"consistency":4,"alternatives_tradeoff":4},"score_reasons":{"evidence_count":"과제 문서, 프로덕션 코드, 테스트 지원 코드, Step Definition, 실행 결과 등 세 개 이상의 근거가 주요 판단에 연결되어 있다.","evidence_quality":"프로젝트 파일 경로와 실제 테스트 실행 결과를 근거로 사용해 사용자가 직접 추적하고 확인할 수 있다.","claim_coverage":"핵심 헥사고날 판정과 대부분의 보완안은 근거 또는 한계와 연결되지만, 제출물 작성 내용, C-2 판단, 로컬 Java 8 확인 주장은 제공된 문맥에서 직접 확인되지 않는다.","uncertainty_boundary":"현재 검증된 동작과 아직 구현되지 않은 Inbound Port, 보상 처리, Repository 의미, Adapter 교체를 분리하고 추가 검증 및 미결정 사항을 명시했다.","consistency":"답변 내부와 제공된 문맥 사이에 직접적인 모순은 없지만, 일부 확정적 사실 주장의 근거 전제가 입력에 포함되지 않아 완전한 추적성은 부족하다.","alternatives_tradeoff":"Inbound 경계에 관한 세 대안은 장단점과 추천 이유가 명확하지만, 결제 보상에 제시한 세 대안은 각각의 trade-off가 충분히 비교되지 않았다."}}