{"version":1,"run_id":"open-question-answers-20260731","scores":{"evidence_count":5,"evidence_quality":5,"claim_coverage":4,"uncertainty_boundary":4,"consistency":4,"alternatives_tradeoff":5},"score_reasons":{"evidence_count":"다섯 답변 전반이 taskB-0 맥락, B-7 실험 결과, 현재 테스트와 도메인 부채 상태 등 3개 이상의 근거 축에 연결된다.","evidence_quality":"근거가 모두 사용자가 제공한 프로젝트 문맥과 확인된 현재 상태에 기대고 있어 추적 가능성과 신뢰도가 높다.","claim_coverage":"각 질문의 핵심 문제 인식과 결론은 대체로 입력 근거와 연결되지만, Q2의 협업 방식과 일부 일반 설계 원칙은 작성자 추론 비중이 남는다.","uncertainty_boundary":"현재 카타에 한정된 결론, 조건부 표현, 사람 판단이 필요한 지점을 구분해 과장을 줄였다. 다만 어디까지가 입력 근거이고 어디부터가 일반화된 실무 판단인지 더 또렷할 수 있다.","consistency":"다섯 답변 모두 입력의 제약과 checked context를 크게 벗어나지 않고, 현재 카타의 한계를 일반 시스템 결론으로 과장하지도 않는다. 다만 일부 추천은 적용 전제가 본문에 더 선명하면 좋다.","alternatives_tradeoff":"모든 질문에서 2개 이상 대안을 비교하고, 속도·가역성·운영 비용·경계 보호 같은 trade-off와 현재 선택 이유를 함께 제시한다."}}